{
  "hard_gates": [
    "no_nan",
    "no_inf",
    "invariants_hold"
  ],
  "soft_gates": {
    "debt": { "warn": 1.0, "fail": 2.0 },
    "cons": { "warn": 0.8, "fail": 1.0 },
    "rec": { "warn": 0.8, "fail": 1.0 }
  },
  "hysteresis": {
    "debt": { "enter": 1.0, "exit": 0.9 },
    "cons": { "enter": 0.8, "exit": 0.7 }
  },
  "rails": [
    { "name": "reduce_dt", "bounds": { "min_dt": 0.01, "factor": 0.5 } },
    { "name": "increase_damping", "bounds": { "max_damping": 0.9, "step": 0.1 } },
    { "name": "project_feasible", "bounds": { "max_iters": 3 } }
  ]
}
